{
  "files": [
    {
      "path": "SKILL.md",
      "sha256": "69c595f147e94744471457c47c4ceb0e2ad37a2fe836859f75b92b86d19a7b50",
      "size": 5202
    },
    {
      "path": "agents/openai.yaml",
      "sha256": "4e0533d97a3414ae094098d72cae01b636178899e33509bb25bc0d4a46aa8677",
      "size": 267
    },
    {
      "path": "meta.json",
      "sha256": "5abfeef1f994c9ac37913fa551cb37f720f878bf817bfa03c10196218ad974f8",
      "size": 1428
    },
    {
      "path": "references/canon-evidence.md",
      "sha256": "febce41b66f3658aab931dc4e2e92eaf5515bcae54ae7d1282a5fe96c529b3dc",
      "size": 6389
    },
    {
      "path": "references/evolution.md",
      "sha256": "ea009913e588d2ba03f8368667dc36c2e402b31fea80bba4492914106c8e2af9",
      "size": 3098
    },
    {
      "path": "references/persona-only.md",
      "sha256": "cb4ca6df7b6490c66d0b07abda6f44636ac19f24f3ef114986437a8fce85a3a0",
      "size": 4063
    },
    {
      "path": "references/persona.md",
      "sha256": "6e8747a95d0c917234e848e577ce8a549f3a8733439604c20b3df34d87fafc39",
      "size": 21778
    },
    {
      "path": "references/task-only.md",
      "sha256": "7019bc65ca10643dc09e09b25eda477519988559456a04b2c597172c2efa64fd",
      "size": 4768
    },
    {
      "path": "references/work.md",
      "sha256": "f23a870e2c8e1595b45ff05fcc64559c1a6cd7af236dfe05db4037b0e4b5f042",
      "size": 8222
    }
  ],
  "manifest_version": 1,
  "payload_sha256": "9dc6bc8d55136f4190455d518183a74d6f2ea3148c7f5b949e05806e98184339",
  "skill_name": "celebrity-kanami"
}
